OCCO:51202100	"coil winder, taper, or finisher"	Class	"electrical, electronics, or electromechanical assembler"	"Coil Winders, Tapers, and Finishers"	"Wind wire coils used in electrical components, such as resistors and transformers, and in electrical equipment and instruments, such as field cores, bobbins, armature cores, electrical motors, generators, and control equipment."		https://www.bls.gov/oes/current/oes512021.htm	Sam Smith|Oliver He			
OCCO:51202200	electrical or electronic equipment assembler	Class	"electrical, electronics, or electromechanical assembler"	Electrical and Electronic Equipment Assemblers	"Assemble or modify electrical or electronic equipment, such as computers, test equipment telemetering systems, electric motors, and batteries."		https://www.bls.gov/oes/current/oes512022.htm	Sam Smith|Oliver He			
OCCO:51202300	electromechanical equipment assembler	Class	"electrical, electronics, or electromechanical assembler"	Electromechanical Equipment Assemblers	"Assemble or modify electromechanical equipment or devices, such as servomechanisms, gyros, dynamometers, magnetic drums, tape drives, brakes, control linkage, actuators, and appliances."		https://www.bls.gov/oes/current/oes512023.htm	Sam Smith|Oliver He			
OCCO:51203100	engine or other machine assembler	Class	engine or other machine assembler (broad)	Engine and Other Machine Assemblers	"Construct, assemble, or rebuild machines, such as engines, turbines, and similar equipment used in such industries as construction, extraction, textiles, and paper manufacturing."		https://www.bls.gov/oes/current/oes512031.htm	Sam Smith|Oliver He			
OCCO:51204100	structural metal fabricator or fitter	Class	structural metal fabricator or fitter (broad)	Structural Metal Fabricators and Fitters	"Fabricate, position, align, and fit parts of structural metal products."		https://www.bls.gov/oes/current/oes512041.htm	Sam Smith|Oliver He			
OCCO:51205100	fiberglass laminator or fabricator	Class	fiberglass laminator or fabricator (broad)	Fiberglass Laminators and Fabricators	"Laminate layers of fiberglass on molds to form boat decks and hulls, bodies for golf carts, automobiles, or other products."		https://www.bls.gov/oes/current/oes512051.htm	Sam Smith|Oliver He			
OCCO:51206100	timing device assembler or adjuster	Class	timing device assembler or adjuster (broad)	Timing Device Assemblers and Adjusters	"Perform precision assembling or adjusting, within narrow tolerances, of timing devices such as digital clocks or timing devices with electrical or electronic components."		https://www.bls.gov/oes/current/oes512061.htm	Sam Smith|Oliver He			
OCCO:51209200	team assembler	Class	miscellaneous assembler or fabricator	Team Assemblers	"Work as part of a team having responsibility for assembling an entire product or component of a product. Team assemblers can perform all tasks conducted by the team in the assembly process and rotate through all or most of them, rather than being assigned to a specific task on a permanent basis. May participate in making management decisions affecting the work. Includes team leaders who work as part of the team."		https://www.bls.gov/oes/current/oes512092.htm	Sam Smith|Oliver He			
OCCO:51301100	baker	Class	baker (broad)	Bakers	"Mix and bake ingredients to produce breads, rolls, cookies, cakes, pies, pastries, or other baked goods."		https://www.bls.gov/oes/current/oes513011.htm	Sam Smith|Oliver He			
OCCO:51302100	butcher or meat cutter	Class	"butcher or other meat, poultry, or fish processing worker"	Butchers and Meat Cutters	"Cut, trim, or prepare consumer-sized portions of meat for use or sale in retail establishments."		https://www.bls.gov/oes/current/oes513021.htm	Sam Smith|Oliver He			
OCCO:51302200	"meat, poultry, or fish cutter or trimmer"	Class	"butcher or other meat, poultry, or fish processing worker"	"Meat, Poultry, and Fish Cutters and Trimmers"	"Use hands or hand tools to perform routine cutting and trimming of meat, poultry, and seafood."		https://www.bls.gov/oes/current/oes513022.htm	Sam Smith|Oliver He			
OCCO:51302300	slaughterer or meat packer	Class	"butcher or other meat, poultry, or fish processing worker"	Slaughterers and Meat Packers	"Perform nonroutine or precision functions involving the preparation of large portions of meat. Work may include specialized slaughtering tasks, cutting standard or premium cuts of meat for marketing, making sausage, or wrapping meats. Work typically occurs in slaughtering, meat packing, or wholesale establishments."		https://www.bls.gov/oes/current/oes513023.htm	Sam Smith|Oliver He			
OCCO:51309100	"food or tobacco roasting, baking, or drying machine operator or tender"	Class	miscellaneous food processing worker	"Food and Tobacco Roasting, Baking, and Drying Machine Operators and Tenders"	"Operate or tend food or tobacco roasting, baking, or drying equipment, including hearth ovens, kiln driers, roasters, char kilns, and vacuum drying equipment."		https://www.bls.gov/oes/current/oes513091.htm	Sam Smith|Oliver He			
OCCO:51309200	food batchmaker	Class	miscellaneous food processing worker	Food Batchmakers	Set up and operate equipment that mixes or blends ingredients used in the manufacturing of food products. Includes candy makers and cheese makers.		https://www.bls.gov/oes/current/oes513092.htm	Sam Smith|Oliver He			
OCCO:51309300	food cooking machine operator or tender	Class	miscellaneous food processing worker	Food Cooking Machine Operators and Tenders	"Operate or tend cooking equipment, such as steam cooking vats, deep fry cookers, pressure cookers, kettles, and boilers, to prepare food products."		https://www.bls.gov/oes/current/oes513093.htm	Sam Smith|Oliver He			
OCCO:51402100	"extruding or drawing machine setter, operator, or tender, metal or plastic"	Class	"forming machine setter, operator, or tender, metal or plastic"	"Extruding and Drawing Machine Setters, Operators, and Tenders, Metal and Plastic"	"Set up, operate, or tend machines to extrude or draw thermoplastic or metal materials into tubes, rods, hoses, wire, bars, or structural shapes."		https://www.bls.gov/oes/current/oes514021.htm	Sam Smith|Oliver He			
OCCO:51402200	"forging machine setter, operator, or tender, metal or plastic"	Class	"forming machine setter, operator, or tender, metal or plastic"	"Forging Machine Setters, Operators, and Tenders, Metal and Plastic"	"Set up, operate, or tend forging machines to taper, shape, or form metal or plastic parts."		https://www.bls.gov/oes/current/oes514022.htm	Sam Smith|Oliver He			
OCCO:51402300	"rolling machine setter, operator, or tender, metal or plastic"	Class	"forming machine setter, operator, or tender, metal or plastic"	"Rolling Machine Setters, Operators, and Tenders, Metal and Plastic"	"Set up, operate, or tend machines to roll steel or plastic forming bends, beads, knurls, rolls, or plate, or to flatten, temper, or reduce gauge of material."		https://www.bls.gov/oes/current/oes514023.htm	Sam Smith|Oliver He			
OCCO:51403100	"cutting, punching, or press machine setter, operator, or tender, metal or plastic"	Class	"machine tool cutting setter, operator, or tender, metal or plastic"	"Cutting, Punching, and Press Machine Setters, Operators, and Tenders, Metal and Plastic"	"Set up, operate, or tend machines to saw, cut, shear, slit, punch, crimp, notch, bend, or straighten metal or plastic material."		https://www.bls.gov/oes/current/oes514031.htm	Sam Smith|Oliver He			
OCCO:51403200	"drilling or boring machine tool setter, operator, or tender, metal or plastic"	Class	"machine tool cutting setter, operator, or tender, metal or plastic"	"Drilling and Boring Machine Tool Setters, Operators, and Tenders, Metal and Plastic"	"Set up, operate, or tend drilling machines to drill, bore, ream, mill, or countersink metal or plastic work pieces."		https://www.bls.gov/oes/current/oes514032.htm	Sam Smith|Oliver He			
OCCO:51403300	"grinding, lapping, polishing, or buffing machine tool setter, operator, or tender, metal or plastic"	Class	"machine tool cutting setter, operator, or tender, metal or plastic"	"Grinding, Lapping, Polishing, and Buffing Machine Tool Setters, Operators, and Tenders, Metal and Plastic"	"Set up, operate, or tend grinding and related tools that remove excess material or burrs from surfaces, sharpen edges or corners, or buff, hone, or polish metal or plastic work pieces."		https://www.bls.gov/oes/current/oes514033.htm	Sam Smith|Oliver He			
OCCO:51403400	"lathe or turning machine tool setter, operator, or tender, metal or plastic"	Class	"machine tool cutting setter, operator, or tender, metal or plastic"	"Lathe and Turning Machine Tool Setters, Operators, and Tenders, Metal and Plastic"	"Set up, operate, or tend lathe and turning machines to turn, bore, thread, form, or face metal or plastic materials, such as wire, rod, or bar stock."		https://www.bls.gov/oes/current/oes514034.htm	Sam Smith|Oliver He			
OCCO:51403500	"milling or planing machine setter, operator, or tender, metal or plastic"	Class	"machine tool cutting setter, operator, or tender, metal or plastic"	"Milling and Planing Machine Setters, Operators, and Tenders, Metal and Plastic"	"Set up, operate, or tend milling or planing machines to mill, plane, shape, groove, or profile metal or plastic work pieces."		https://www.bls.gov/oes/current/oes514035.htm	Sam Smith|Oliver He			
OCCO:51404100	machinist	Class	machinist (broad)	Machinists	"Set up and operate a variety of machine tools to produce precision parts and instruments out of metal. Includes precision instrument makers who fabricate, modify, or repair mechanical instruments. May also fabricate and modify parts to make or repair machine tools or maintain industrial machines, applying knowledge of mechanics, mathematics, metal properties, layout, and machining procedures."		https://www.bls.gov/oes/current/oes514041.htm	Sam Smith|Oliver He			
OCCO:51405100	metal-refining furnace operator or tender	Class	"metal furnace operator, tender, pourer, or caster"	Metal-Refining Furnace Operators and Tenders	"Operate or tend furnaces, such as gas, oil, coal, electric-arc or electric induction, open-hearth, or oxygen furnaces, to melt and refine metal before casting or to produce specified types of steel."		https://www.bls.gov/oes/current/oes514051.htm	Sam Smith|Oliver He			
OCCO:51405200	"pourer or caster, metal"	Class	"metal furnace operator, tender, pourer, or caster"	"Pourers and Casters, Metal"	Operate hand-controlled mechanisms to pour and regulate the flow of molten metal into molds to produce castings or ingots.		https://www.bls.gov/oes/current/oes514052.htm	Sam Smith|Oliver He			
OCCO:51406100	"model maker, metal or plastic"	Class	"model maker or patternmaker, metal or plastic"	"Model Makers, Metal and Plastic"	"Set up and operate machines, such as lathes, milling and engraving machines, and jig borers to make working models of metal or plastic objects. Includes template makers."		https://www.bls.gov/oes/current/oes514061.htm	Sam Smith|Oliver He			
OCCO:51406200	"patternmaker, metal or plastic"	Class	"model maker or patternmaker, metal or plastic"	"Patternmakers, Metal and Plastic"	"Lay out, machine, fit, and assemble castings and parts to metal or plastic foundry patterns, core boxes, or match plates."		https://www.bls.gov/oes/current/oes514062.htm	Sam Smith|Oliver He			
OCCO:51407100	foundry mold or coremaker	Class	"molder or molding machine setter, operator, or tender, metal or plastic"	Foundry Mold and Coremakers	Make or form wax or sand cores or molds used in the production of metal castings in foundries.		https://www.bls.gov/oes/current/oes514071.htm	Sam Smith|Oliver He			
OCCO:51407200	"molding, coremaking, or casting machine setter, operator, or tender, metal or plastic"	Class	"molder or molding machine setter, operator, or tender, metal or plastic"	"Molding, Coremaking, and Casting Machine Setters, Operators, and Tenders, Metal and Plastic"	"Set up, operate, or tend metal or plastic molding, casting, or coremaking machines to mold or cast metal or thermoplastic parts or products."		https://www.bls.gov/oes/current/oes514072.htm	Sam Smith|Oliver He			
OCCO:51408100	"multiple machine tool setter, operator, or tender, metal or plastic"	Class	"multiple machine tool setter, operator, or tender, metal or plastic (broad)"	"Multiple Machine Tool Setters, Operators, and Tenders, Metal and Plastic"	"Set up, operate, or tend more than one type of cutting or forming machine tool or robot."		https://www.bls.gov/oes/current/oes514081.htm	Sam Smith|Oliver He			
OCCO:51411100	tool or die maker	Class	tool or die maker (broad)	Tool and Die Makers	"Analyze specifications, lay out metal stock, set up and operate machine tools, and fit and assemble parts to make and repair dies, cutting tools, jigs, fixtures, gauges, and machinists' hand tools."		https://www.bls.gov/oes/current/oes514111.htm	Sam Smith|Oliver He			
OCCO:51412200	"welding, soldering, or brazing machine setter, operator, or tender"	Class	"welding, soldering, or brazing worker"	"Welding, Soldering, and Brazing Machine Setters, Operators, and Tenders"	"Set up, operate, or tend welding, soldering, or brazing machines or robots that weld, braze, solder, or heat treat metal products, components, or assemblies. Includes workers who operate laser cutters or laser-beam machines."		https://www.bls.gov/oes/current/oes514122.htm	Sam Smith|Oliver He			
OCCO:51419100	"heat treating equipment setter, operator, or tender, metal or plastic"	Class	miscellaneous metal worker or plastic worker	"Heat Treating Equipment Setters, Operators, and Tenders, Metal and Plastic"	"Set up, operate, or tend heating equipment, such as heat-treating furnaces, flame-hardening machines, induction machines, soaking pits, or vacuum equipment to temper, harden, anneal, or heat treat metal or plastic objects."		https://www.bls.gov/oes/current/oes514191.htm	Sam Smith|Oliver He			
OCCO:51419200	"layout worker, metal or plastic"	Class	miscellaneous metal worker or plastic worker	"Layout Workers, Metal and Plastic"	"Lay out reference points and dimensions on metal or plastic stock or workpieces, such as sheets, plates, tubes, structural shapes, castings, or machine parts, for further processing. Includes shipfitters."		https://www.bls.gov/oes/current/oes514192.htm	Sam Smith|Oliver He			
OCCO:51419400	"tool grinder, filer, or sharpener"	Class	miscellaneous metal worker or plastic worker	"Tool Grinders, Filers, and Sharpeners"	"Perform precision smoothing, sharpening, polishing, or grinding of metal objects."		https://www.bls.gov/oes/current/oes514194.htm	Sam Smith|Oliver He			
OCCO:51511100	prepress technician or worker	Class	printing worker	Prepress Technicians and Workers	Format and proof text and images submitted by designers and clients into finished pages that can be printed. Includes digital and photo typesetting. May produce printing plates.		https://www.bls.gov/oes/current/oes515111.htm	Sam Smith|Oliver He			
OCCO:51511200	printing press operator	Class	printing worker	Printing Press Operators	"Set up and operate digital, letterpress, lithographic, flexographic, gravure, or other printing machines. Includes short-run offset printing presses."		https://www.bls.gov/oes/current/oes515112.htm	Sam Smith|Oliver He			
OCCO:51511300	print binding or finishing worker	Class	printing worker	Print Binding and Finishing Workers	Bind books and other publications or finish printed products by hand or machine. May set up binding and finishing machines.		https://www.bls.gov/oes/current/oes515113.htm	Sam Smith|Oliver He			
OCCO:51601100	laundry or dry-cleaning worker	Class	laundry or dry-cleaning worker (broad)	Laundry and Dry-Cleaning Workers	"Operate or tend washing or dry-cleaning machines to wash or dry-clean industrial or household articles, such as cloth garments, suede, leather, furs, blankets, draperies, linens, rugs, and carpets. Includes spotters and dyers of these articles."		https://www.bls.gov/oes/current/oes516011.htm	Sam Smith|Oliver He			
OCCO:51602100	"presser, textile, garment, or related materials"	Class	"presser, textile, garment, or related materials (broad)"	"Pressers, Textile, Garment, and Related Materials"	Press or shape articles by hand or machine.		https://www.bls.gov/oes/current/oes516021.htm	Sam Smith|Oliver He			
OCCO:51603100	sewing machine operator	Class	sewing machine operator (broad)	Sewing Machine Operators	"Operate or tend sewing machines to join, reinforce, decorate, or perform related sewing operations in the manufacture of garment or nongarment products."		https://www.bls.gov/oes/current/oes516031.htm	Sam Smith|Oliver He			
OCCO:51604100	shoe or leather worker or repairer	Class	shoe or leather worker	Shoe and Leather Workers and Repairers	"Construct, decorate, or repair leather and leather-like products, such as luggage, shoes, and saddles. May use hand tools."		https://www.bls.gov/oes/current/oes516041.htm	Sam Smith|Oliver He			
OCCO:51604200	shoe machine operator or tender	Class	shoe or leather worker	Shoe Machine Operators and Tenders	"Operate or tend a variety of machines to join, decorate, reinforce, or finish shoes and shoe parts."		https://www.bls.gov/oes/current/oes516042.htm	Sam Smith|Oliver He			
OCCO:51605100	"sewer, hand"	Class	"tailor, dressmaker, or sewer"	"Sewers, Hand"	"Sew, join, reinforce, or finish, usually with needle and thread, a variety of manufactured items. Includes weavers and stitchers."		https://www.bls.gov/oes/current/oes516051.htm	Sam Smith|Oliver He			
OCCO:51605200	"tailor, dressmaker, or custom sewer"	Class	"tailor, dressmaker, or sewer"	"Tailors, Dressmakers, and Custom Sewers"	"Design, make, alter, repair, or fit garments."		https://www.bls.gov/oes/current/oes516052.htm	Sam Smith|Oliver He			
OCCO:51606100	textile bleaching or dyeing machine operator or tender	Class	"textile machine setter, operator, or tender"	Textile Bleaching and Dyeing Machine Operators and Tenders	"Operate or tend machines to bleach, shrink, wash, dye, or finish textiles or synthetic or glass fibers."		https://www.bls.gov/oes/current/oes516061.htm	Sam Smith|Oliver He			
OCCO:51606200	"textile cutting machine setter, operator, or ten"	Class	"textile machine setter, operator, or tender"	"Textile Cutting Machine Setters, Operators, and Tenders"	"Set up, operate, or tend machines that cut textiles."		https://www.bls.gov/oes/current/oes516062.htm	Sam Smith|Oliver He			
OCCO:51606300	"textile knitting or weaving machine setter, operator, or tender"	Class	"textile machine setter, operator, or tender"	"Textile Knitting and Weaving Machine Setters, Operators, and Tenders"	"Set up, operate, or tend machines that knit, loop, weave, or draw in textiles."		https://www.bls.gov/oes/current/oes516063.htm	Sam Smith|Oliver He			
OCCO:51606400	"textile winding, twisting, or drawing out machine setter, operator, or tender"	Class	"textile machine setter, operator, or tender"	"Textile Winding, Twisting, and Drawing Out Machine Setters, Operators, and Tenders"	"Set up, operate, or tend machines that wind or twist textiles; or draw out and combine sliver, such as wool, hemp, or synthetic fibers. Includes slubber machine and drawing frame operators."		https://www.bls.gov/oes/current/oes516064.htm	Sam Smith|Oliver He			
OCCO:51609100	"extruding or forming machine setter, operator, or tender, synthetic or glass fiber"	Class	"miscellaneous textile, apparel, or furnishings worker"	"Extruding and Forming Machine Setters, Operators, and Tenders, Synthetic and Glass Fibers"	"Set up, operate, or tend machines that extrude and form continuous filaments from synthetic materials, such as liquid polymer, rayon, and fiberglass."		https://www.bls.gov/oes/current/oes516091.htm	Sam Smith|Oliver He			
OCCO:51609200	fabric or apparel patternmaker	Class	"miscellaneous textile, apparel, or furnishings worker"	Fabric and Apparel Patternmakers	Draw and construct sets of precision master fabric patterns or layouts. May also mark and cut fabrics and apparel.		https://www.bls.gov/oes/current/oes516092.htm	Sam Smith|Oliver He			
OCCO:51609300	upholsterer	Class	"miscellaneous textile, apparel, or furnishings worker"	Upholsterers	"Make, repair, or replace upholstery for household furniture or transportation vehicles."		https://www.bls.gov/oes/current/oes516093.htm	Sam Smith|Oliver He			
OCCO:51701100	cabinetmaker or bench carpenter	Class	cabinetmaker or bench carpenter (broad)	Cabinetmakers and Bench Carpenters	"Cut, shape, and assemble wooden articles or set up and operate a variety of woodworking machines, such as power saws, jointers, and mortisers to surface, cut, or shape lumber or to fabricate parts for wood products."		https://www.bls.gov/oes/current/oes517011.htm	Sam Smith|Oliver He			
OCCO:51702100	furniture finisher	Class	furniture finisher (broad)	Furniture Finishers	"Shape, finish, and refinish damaged, worn, or used furniture or new high-grade furniture to specified color or finish."		https://www.bls.gov/oes/current/oes517021.htm	Sam Smith|Oliver He			
OCCO:51703100	"model maker, wood"	Class	"model maker or patternmaker, wood"	"Model Makers, Wood"	Construct full-size and scale wooden precision models of products. Includes wood jig builders and loft workers.		https://www.bls.gov/oes/current/oes517031.htm	Sam Smith|Oliver He			
OCCO:51703200	"patternmaker, wood"	Class	"model maker or patternmaker, wood"	"Patternmakers, Wood"	"Plan, lay out, and construct wooden unit or sectional patterns used in forming sand molds for castings."		https://www.bls.gov/oes/current/oes517032.htm	Sam Smith|Oliver He			
OCCO:51704100	"sawing machine setter, operator, or tender, wood"	Class	"woodworking machine setter, operator, or tender"	"Sawing Machine Setters, Operators, and Tenders, Wood"	"Set up, operate, or tend wood sawing machines. May operate computer numerically controlled (CNC) equipment. Includes lead sawyers."		https://www.bls.gov/oes/current/oes517041.htm	Sam Smith|Oliver He			
OCCO:51704200	"woodworking machine setter, operator, or tender, except sawing"	Class	"woodworking machine setter, operator, or tender"	"Woodworking Machine Setters, Operators, and Tenders, Except Sawing"	"Set up, operate, or tend woodworking machines, such as drill presses, lathes, shapers, routers, sanders, planers, and wood nailing machines. May operate computer numerically controlled (CNC) equipment."		https://www.bls.gov/oes/current/oes517042.htm	Sam Smith|Oliver He			
OCCO:51801100	nuclear power reactor operator	Class	"power plant operator, distributor, or dispatcher"	Nuclear Power Reactor Operators	"Operate or control nuclear reactors. Move control rods, start and stop equipment, monitor and adjust controls, and record data in logs. Implement emergency procedures when needed. May respond to abnormalities, determine cause, and recommend corrective action."		https://www.bls.gov/oes/current/oes518011.htm	Sam Smith|Oliver He			
OCCO:51801200	power distributor or dispatcher	Class	"power plant operator, distributor, or dispatcher"	Power Distributors and Dispatchers	"Coordinate, regulate, or distribute electricity or steam."		https://www.bls.gov/oes/current/oes518012.htm	Sam Smith|Oliver He			
OCCO:51801300	power plant operator	Class	"power plant operator, distributor, or dispatcher"	Power Plant Operators	"Control, operate, or maintain machinery to generate electric power. Includes auxiliary equipment operators."		https://www.bls.gov/oes/current/oes518013.htm	Sam Smith|Oliver He			
OCCO:51801303	biomass plant technician	Class	"power plant operator, distributor, or dispatcher"	Biomass Plant Technicians	Control and monitor biomass plant activities and perform maintenance as needed.		https://www.bls.gov/oes/current/oes518013.htm	Sam Smith|Oliver He			
OCCO:51801304	hydroelectric plant technician	Class	"power plant operator, distributor, or dispatcher"	Hydroelectric Plant Technicians	"Monitor and control activities associated with hydropower generation. Operate plant equipment, such as turbines, pumps, valves, gates, fans, electric control boards, and battery banks. Monitor equipment operation and performance and make necessary adjustments to ensure optimal performance. Perform equipment maintenance and repair as necessary."		https://www.bls.gov/oes/current/oes518013.htm	Sam Smith|Oliver He			
OCCO:51802100	stationary engineer or boiler operator	Class	stationary engineer or boiler operator (broad)	Stationary Engineers and Boiler Operators	"Operate or maintain stationary engines, boilers, or other mechanical equipment to provide utilities for buildings or industrial processes. Operate equipment such as steam engines, generators, motors, turbines, and steam boilers."		https://www.bls.gov/oes/current/oes518021.htm	Sam Smith|Oliver He			
OCCO:51803100	water or wastewater treatment plant or system operator	Class	water or wastewater treatment plant or system operator (broad)	Water and Wastewater Treatment Plant and System Operators	"Operate or control an entire process or system of machines, often through the use of control boards, to transfer or treat water or wastewater."		https://www.bls.gov/oes/current/oes518031.htm	Sam Smith|Oliver He			
OCCO:51809100	chemical plant or system operator	Class	miscellaneous plant or system operator	Chemical Plant and System Operators	Control or operate entire chemical processes or system of machines.		https://www.bls.gov/oes/current/oes518091.htm	Sam Smith|Oliver He			
OCCO:51809200	gas plant operator	Class	miscellaneous plant or system operator	Gas Plant Operators	Distribute or process gas for utility companies and others by controlling compressors to maintain specified pressures on main pipelines.		https://www.bls.gov/oes/current/oes518092.htm	Sam Smith|Oliver He			
