OCCO:25904300	"teaching assistant, special education"	Class	teaching assistant	"Teaching Assistants, Special Education"	"Assist a preschool, elementary, middle, or secondary school teacher to provide academic, social, or life skills to students who have learning, emotional, or physical disabilities. Serve in a position for which a teacher has primary responsibility for the design and implementation of educational programs and services."	https://www.bls.gov/soc/		Sam Smith|Oliver He			
OCCO:25904400	"teaching assistant, postsecondary"	Class	teaching assistant	"Teaching Assistants, Postsecondary"	"Assist faculty or other instructional staff in postsecondary institutions by performing instructional support activities, such as developing teaching materials, leading discussion groups, preparing and giving examinations, and grading examinations or papers."	https://www.bls.gov/soc/		Sam Smith|Oliver He			
OCCO:25904900	"teaching assistant, all other"	Class	teaching assistant	"Teaching Assistants, All Other"	All teaching assistants not listed separately.	https://www.bls.gov/soc/		Sam Smith|Oliver He			
OCCO:25909000	miscellaneous educational instruction or library worker	Class	other educational instruction or library occupation	Miscellaneous Educational Instruction and Library Workers		https://www.bls.gov/soc/		Sam Smith|Oliver He			
OCCO:25909900	"educational instruction or library worker, all other"	Class	miscellaneous educational instruction or library worker	"Educational Instruction and Library Workers, All Other"	All educational instruction and library workers not listed separately.	https://www.bls.gov/soc/		Sam Smith|Oliver He			
OCCO:27000000	"arts, design, entertainment, sports, and media occupation holder"	Class	occupation holder	"Arts, Design, Entertainment, Sports, and Media Occupations"		https://www.bls.gov/soc/		Sam Smith|Oliver He			
OCCO:27100000	art or design worker	Class	"arts, design, entertainment, sports, and media occupation holder"	Art and Design Workers		https://www.bls.gov/soc/		Sam Smith|Oliver He			
OCCO:27101000	artist or related worker	Class	art or design worker	Artists and Related Workers		https://www.bls.gov/soc/		Sam Smith|Oliver He			
OCCO:27101400	special effects artist or animator	Class	artist or related worker	Special Effects Artists and Animators	"Create special effects or animations using film, video, computers, or other electronic tools and media for use in products, such as computer games, movies, music videos, and commercials."	https://www.bls.gov/soc/		Sam Smith|Oliver He			
OCCO:27101900	"artist or related worker, all other"	Class	artist or related worker	"Artists and Related Workers, All Other"	All artists and related workers not listed separately.	https://www.bls.gov/soc/		Sam Smith|Oliver He			
OCCO:27102000	designer	Class	art or design worker	Designers		https://www.bls.gov/soc/		Sam Smith|Oliver He			
OCCO:27102900	"designer, all other"	Class	designer	"Designers, All Other"	All designers not listed separately.	https://www.bls.gov/soc/		Sam Smith|Oliver He			
OCCO:27200000	"entertainer or performer, sports or related worker"	Class	"arts, design, entertainment, sports, and media occupation holder"	"Entertainers and Performers, Sports and Related Workers"		https://www.bls.gov/soc/		Sam Smith|Oliver He			
OCCO:27201000	"actor, producer, or director"	Class	"entertainer or performer, sports or related worker"	"Actors, Producers, and Directors"		https://www.bls.gov/soc/		Sam Smith|Oliver He			
OCCO:27201200	producer or director	Class	"actor, producer, or director"	Producers and Directors	"Produce or direct stage, television, radio, video, or film productions for entertainment, information, or instruction. Responsible for creative decisions, such as interpretation of script, choice of actors or guests, set design, sound, special effects, and choreography."	https://www.bls.gov/soc/		Sam Smith|Oliver He			
OCCO:27201203	media programming director	Class	"actor, producer, or director"	Media Programming Directors	"Direct and coordinate activities of personnel engaged in preparation of radio or television station program schedules and programs, such as sports or news."	https://www.bls.gov/soc/		Sam Smith|Oliver He			
OCCO:27201205	media technical directors/manager	Class	"actor, producer, or director"	Media Technical Directors/Managers	"Coordinate activities of technical departments, such as taping, editing, engineering, and maintenance, to produce radio or television programs."	https://www.bls.gov/soc/		Sam Smith|Oliver He			
OCCO:27202000	"athlete, coache, umpire, or related worker"	Class	"entertainer or performer, sports or related worker"	"Athletes, Coaches, Umpires, and Related Workers"		https://www.bls.gov/soc/		Sam Smith|Oliver He			
OCCO:27203000	dancer or choreographer	Class	"entertainer or performer, sports or related worker"	Dancers and Choreographers		https://www.bls.gov/soc/		Sam Smith|Oliver He			
OCCO:27204000	"musician, singer, or related worker"	Class	"entertainer or performer, sports or related worker"	"Musicians, Singers, and Related Workers"		https://www.bls.gov/soc/		Sam Smith|Oliver He			
OCCO:27204100	music director or composer	Class	"musician, singer, or related worker"	Music Directors and Composers	"Conduct, direct, plan, and lead instrumental or vocal performances by musical artists or groups, such as orchestras, bands, choirs, and glee clubs; or create original works of music."	https://www.bls.gov/soc/		Sam Smith|Oliver He			
OCCO:27204200	musician or singer	Class	"musician, singer, or related worker"	Musicians and Singers	"Play one or more musical instruments or sing. May perform on stage, for broadcasting, or for sound or video recording."	https://www.bls.gov/soc/		Sam Smith|Oliver He			
OCCO:27209000	"miscellaneous entertainer or performer, sports or related worker"	Class	"entertainer or performer, sports or related worker"	"Miscellaneous Entertainers and Performers, Sports and Related Workers"		https://www.bls.gov/soc/		Sam Smith|Oliver He			
OCCO:27209100	"disc jockey, except radio"	Class	"miscellaneous entertainer or performer, sports or related worker"	"Disc Jockeys, Except Radio"	"Play prerecorded music for live audiences at venues or events such as clubs, parties, or wedding receptions. May use techniques such as mixing, cutting, or sampling to manipulate recordings. May also perform as emcee (master of ceremonies)."	https://www.bls.gov/soc/		Sam Smith|Oliver He			
OCCO:27209900	"entertainer or performer, sports or related worker, all other"	Class	"miscellaneous entertainer or performer, sports or related worker"	"Entertainers and Performers, Sports and Related Workers, All Other"	"All entertainers and performers, sports and related workers not listed separately."	https://www.bls.gov/soc/		Sam Smith|Oliver He			
OCCO:27300000	media or communication worker	Class	"arts, design, entertainment, sports, and media occupation holder"	Media and Communication Workers		https://www.bls.gov/soc/		Sam Smith|Oliver He			
OCCO:27301000	broadcast announcer or radio disc jockey (broad)	Class	media or communication worker	Broadcast Announcers and Radio Disc Jockeys		https://www.bls.gov/soc/		Sam Smith|Oliver He			
OCCO:27301100	broadcast announcer or radio disc jockey	Class	broadcast announcer or radio disc jockey (broad)	Broadcast Announcers and Radio Disc Jockeys	"Speak or read from scripted materials, such as news reports or commercial messages, on radio, television, or other communications media. May play and queue music, announce artist or title of performance, identify station, or interview guests."	https://www.bls.gov/soc/		Sam Smith|Oliver He			
OCCO:27302000	"news analyst, reporter or journalist"	Class	media or communication worker	"News Analysts, Reporters and Journalists"		https://www.bls.gov/soc/		Sam Smith|Oliver He			
OCCO:27302300	"news analyst, reporter, or journalist"	Class	"news analyst, reporter or journalist"	"News Analysts, Reporters, and Journalists"	"Narrate or write news stories, reviews, or commentary for print, broadcast, or other communications media such as newspapers, magazines, radio, or television. May collect and analyze information through interview, investigation, or observation."	https://www.bls.gov/soc/		Sam Smith|Oliver He			
OCCO:27303000	public relations specialist (broad)	Class	media or communication worker	Public Relations Specialists		https://www.bls.gov/soc/		Sam Smith|Oliver He			
OCCO:27304000	writer or editor	Class	media or communication worker	Writers and Editors		https://www.bls.gov/soc/		Sam Smith|Oliver He			
OCCO:27304300	writer or author	Class	writer or editor	Writers and Authors	"Originate and prepare written material, such as scripts, stories, advertisements, and other material."	https://www.bls.gov/soc/		Sam Smith|Oliver He			
OCCO:27309000	miscellaneous media or communication worker	Class	media or communication worker	Miscellaneous Media and Communication Workers		https://www.bls.gov/soc/		Sam Smith|Oliver He			
OCCO:27309200	court reporter or simultaneous captioner	Class	miscellaneous media or communication worker	Court Reporters and Simultaneous Captioners	"Use verbatim methods and equipment to capture, store, retrieve, and transcribe pretrial and trial proceedings or other information. Includes stenocaptioners who operate computerized stenographic captioning equipment to provide captions of live or prerecorded broadcasts for hearing-impaired viewers."	https://www.bls.gov/soc/		Sam Smith|Oliver He			
OCCO:27309900	"media or communication worker, all other"	Class	miscellaneous media or communication worker	"Media and Communication Workers, All Other"	All media and communication workers not listed separately.	https://www.bls.gov/soc/		Sam Smith|Oliver He			
OCCO:27400000	media or communication equipment worker	Class	"arts, design, entertainment, sports, and media occupation holder"	Media and Communication Equipment Workers		https://www.bls.gov/soc/		Sam Smith|Oliver He			
OCCO:27401000	"broadcast, sound, or lighting technician"	Class	media or communication equipment worker	"Broadcast, Sound, and Lighting Technicians"		https://www.bls.gov/soc/		Sam Smith|Oliver He			
OCCO:27401100	audio or video technician	Class	"broadcast, sound, or lighting technician"	Audio and Video Technicians	"Set up, maintain, and dismantle audio and video equipment, such as microphones, sound speakers, connecting wires and cables, sound and mixing boards, video cameras, video monitors and servers, and related electronic equipment for live or recorded events, such as concerts, meetings, conventions, presentations, podcasts, news conferences, and sporting events."	https://www.bls.gov/soc/		Sam Smith|Oliver He			
OCCO:27401500	lighting technician	Class	"broadcast, sound, or lighting technician"	Lighting Technicians	"Set up, maintain, and dismantle light fixtures, lighting control devices, and the associated lighting electrical and rigging equipment used for photography, television, film, video, and live productions. May focus or operate light fixtures, or attach color filters or other lighting accessories."	https://www.bls.gov/soc/		Sam Smith|Oliver He			
OCCO:27402000	photographer (broad)	Class	media or communication equipment worker	Photographers		https://www.bls.gov/soc/		Sam Smith|Oliver He			
OCCO:27403000	"television, video, or film camera operator or editor"	Class	media or communication equipment worker	"Television, Video, and Film Camera Operators and Editors"		https://www.bls.gov/soc/		Sam Smith|Oliver He			
OCCO:27403100	"camera operator, television, video, or film"	Class	"television, video, or film camera operator or editor"	"Camera Operators, Television, Video, and Film"	"Operate television, video, or film camera to record images or scenes for television, video, or film productions."	https://www.bls.gov/soc/		Sam Smith|Oliver He			
OCCO:27409000	miscellaneous media or communication equipment worker	Class	media or communication equipment worker	Miscellaneous Media and Communication Equipment Workers		https://www.bls.gov/soc/		Sam Smith|Oliver He			
OCCO:27409900	"media or communication equipment worker, all other"	Class	miscellaneous media or communication equipment worker	"Media and Communication Equipment Workers, All Other"	All media and communication equipment workers not listed separately.	https://www.bls.gov/soc/		Sam Smith|Oliver He			
OCCO:29000000	healthcare practitioner or technical occupation holder	Class	occupation holder	Healthcare Practitioners and Technical Occupations		https://www.bls.gov/soc/		Sam Smith|Oliver He			
OCCO:29100000	healthcare diagnosing or treating practitioner	Class	healthcare practitioner or technical occupation holder	Healthcare Diagnosing or Treating Practitioners		https://www.bls.gov/soc/		Sam Smith|Oliver He			
OCCO:29101000	chiropractor (broad)	Class	healthcare diagnosing or treating practitioner	Chiropractors		https://www.bls.gov/soc/		Sam Smith|Oliver He			
OCCO:29102000	dentist	Class	healthcare diagnosing or treating practitioner	Dentists		https://www.bls.gov/soc/		Sam Smith|Oliver He			
OCCO:29102900	"dentist, all other specialist"	Class	dentist	"Dentists, All Other Specialists"	All dentists not listed separately.	https://www.bls.gov/soc/		Sam Smith|Oliver He			
OCCO:29103000	dietitian or nutritionist (broad)	Class	healthcare diagnosing or treating practitioner	Dietitians and Nutritionists		https://www.bls.gov/soc/		Sam Smith|Oliver He			
OCCO:29104000	optometrist (broad)	Class	healthcare diagnosing or treating practitioner	Optometrists		https://www.bls.gov/soc/		Sam Smith|Oliver He			
OCCO:29105000	pharmacist (broad)	Class	healthcare diagnosing or treating practitioner	Pharmacists		https://www.bls.gov/soc/		Sam Smith|Oliver He			
OCCO:29107000	physician assistant (broad)	Class	healthcare diagnosing or treating practitioner	Physician Assistants		https://www.bls.gov/soc/		Sam Smith|Oliver He			
OCCO:29108000	podiatrist (broad)	Class	healthcare diagnosing or treating practitioner	Podiatrists		https://www.bls.gov/soc/		Sam Smith|Oliver He			
OCCO:29112000	therapist	Class	healthcare diagnosing or treating practitioner	Therapists		https://www.bls.gov/soc/		Sam Smith|Oliver He			
OCCO:29112900	"therapist, all other"	Class	therapist	"Therapists, All Other"	All therapists not listed separately.	https://www.bls.gov/soc/		Sam Smith|Oliver He			
OCCO:29113000	veterinarian (broad)	Class	healthcare diagnosing or treating practitioner	Veterinarians		https://www.bls.gov/soc/		Sam Smith|Oliver He			
OCCO:29114000	registered nurse	Class	healthcare diagnosing or treating practitioner	Registered Nurses		https://www.bls.gov/soc/		Sam Smith|Oliver He			
OCCO:29115000	nurse anesthetist (broad)	Class	healthcare diagnosing or treating practitioner	Nurse Anesthetists		https://www.bls.gov/soc/		Sam Smith|Oliver He			
OCCO:29116000	nurse midwife	Class	healthcare diagnosing or treating practitioner	Nurse Midwives		https://www.bls.gov/soc/		Sam Smith|Oliver He			
OCCO:29117000	nurse practitioner (broad)	Class	healthcare diagnosing or treating practitioner	Nurse Practitioners		https://www.bls.gov/soc/		Sam Smith|Oliver He			
OCCO:29118000	audiologist (broad)	Class	healthcare diagnosing or treating practitioner	Audiologists		https://www.bls.gov/soc/		Sam Smith|Oliver He			
OCCO:29121000	physician	Class	healthcare diagnosing or treating practitioner	Physicians		https://www.bls.gov/soc/		Sam Smith|Oliver He			
OCCO:29121200	cardiologist	Class	physician	Cardiologists	"Diagnose, treat, manage, and prevent diseases or conditions of the cardiovascular system. May further subspecialize in interventional procedures (e.g., balloon angioplasty and stent placement), echocardiography, or electrophysiology."	https://www.bls.gov/soc/		Sam Smith|Oliver He			
OCCO:29121400	emergency medicine physician	Class	physician	Emergency Medicine Physicians	"Make immediate medical decisions and act to prevent death or further disability. Provide immediate recognition, evaluation, care, stabilization, and disposition of patients. May direct emergency medical staff in an emergency department."	https://www.bls.gov/soc/		Sam Smith|Oliver He			
OCCO:29121500	family medicine physician	Class	physician	Family Medicine Physicians	"Diagnose, treat, and provide preventive care to individuals and families across the lifespan. May refer patients to specialists when needed for further diagnosis or treatment."	https://www.bls.gov/soc/		Sam Smith|Oliver He			
OCCO:29121600	general internal medicine physician	Class	physician	General Internal Medicine Physicians	"Diagnose and provide nonsurgical treatment for a wide range of diseases and injuries of internal organ systems. Provide care mainly for adults and adolescents, and are based primarily in an outpatient care setting."	https://www.bls.gov/soc/		Sam Smith|Oliver He			
OCCO:29122200	"physician, pathologist"	Class	physician	"Physicians, Pathologists"	"Diagnose diseases and conduct lab tests using organs, body tissues, and fluids. Includes medical examiners."	https://www.bls.gov/soc/		Sam Smith|Oliver He			
OCCO:29122900	"physician, all other"	Class	physician	"Physicians, All Other"	All physicians not listed separately.	https://www.bls.gov/soc/		Sam Smith|Oliver He			
OCCO:29124000	surgeon	Class	healthcare diagnosing or treating practitioner	Surgeons		https://www.bls.gov/soc/		Sam Smith|Oliver He			
OCCO:29124100	"ophthalmologist, except pediatric"	Class	surgeon	"Ophthalmologists, Except Pediatric"	Diagnose and perform surgery to treat and help prevent disorders and diseases of the eye. May also provide vision services for treatment including glasses and contacts.	https://www.bls.gov/soc/		Sam Smith|Oliver He			
OCCO:29124200	"orthopedic surgeon, except pediatric"	Class	surgeon	"Orthopedic Surgeons, Except Pediatric"	Diagnose and perform surgery to treat and prevent rheumatic and other diseases in the musculoskeletal system.	https://www.bls.gov/soc/		Sam Smith|Oliver He			
OCCO:29124300	pediatric surgeon	Class	surgeon	Pediatric Surgeons	"Diagnose and perform surgery to treat fetal abnormalities and birth defects, diseases, and injuries in fetuses, premature and newborn infants, children, and adolescents. Includes all pediatric surgical specialties and subspecialties."	https://www.bls.gov/soc/		Sam Smith|Oliver He			
OCCO:29124900	"surgeon, all other"	Class	surgeon	"Surgeons, All Other"	All surgeons not listed separately.	https://www.bls.gov/soc/		Sam Smith|Oliver He			
OCCO:29129000	miscellaneous healthcare diagnosing or treating practitioner	Class	healthcare diagnosing or treating practitioner	Miscellaneous Healthcare Diagnosing or Treating Practitioners		https://www.bls.gov/soc/		Sam Smith|Oliver He			
OCCO:29129900	"healthcare diagnosing or treating practitioner, all other"	Class	miscellaneous healthcare diagnosing or treating practitioner	"Healthcare Diagnosing or Treating Practitioners, All Other"	All healthcare diagnosing or treating practitioners not listed separately.	https://www.bls.gov/soc/		Sam Smith|Oliver He			
OCCO:29200000	health technologist or technician	Class	healthcare practitioner or technical occupation holder	Health Technologists and Technicians		https://www.bls.gov/soc/		Sam Smith|Oliver He			
OCCO:29201000	clinical laboratory technologist or technician	Class	health technologist or technician	Clinical Laboratory Technologists and Technicians		https://www.bls.gov/soc/		Sam Smith|Oliver He			
OCCO:29201104	histotechnologist	Class	clinical laboratory technologist or technician	Histotechnologists	Apply knowledge of health and disease causes to evaluate new laboratory techniques and procedures to examine tissue samples. Process and prepare histological slides from tissue sections for microscopic examination and diagnosis by pathologists. May solve technical or instrument problems or assist with research studies.	https://www.bls.gov/soc/		Sam Smith|Oliver He			
OCCO:29201201	histology technician	Class	clinical laboratory technologist or technician	Histology Technicians	Prepare histological slides from tissue sections for microscopic examination and diagnosis by pathologists. May assist with research studies.	https://www.bls.gov/soc/		Sam Smith|Oliver He			
OCCO:29203000	diagnostic related technologist or technician	Class	health technologist or technician	Diagnostic Related Technologists and Technicians		https://www.bls.gov/soc/		Sam Smith|Oliver He			
OCCO:29203400	radiologic technologist or technician	Class	diagnostic related technologist or technician	Radiologic Technologists and Technicians	Take x-rays and CAT scans or administer nonradioactive materials into patient's bloodstream for diagnostic or research purposes. Includes radiologic technologists and technicians who specialize in other scanning modalities.	https://www.bls.gov/soc/		Sam Smith|Oliver He			
OCCO:29203600	medical dosimetrist	Class	diagnostic related technologist or technician	Medical Dosimetrists	"Generate radiation treatment plans, develop radiation dose calculations, communicate and supervise the treatment plan implementation, and consult with members of radiation oncology team."	https://www.bls.gov/soc/		Sam Smith|Oliver He			
OCCO:29204000	emergency medical technician or paramedics	Class	health technologist or technician	Emergency Medical Technicians and Paramedics		https://www.bls.gov/soc/		Sam Smith|Oliver He			
OCCO:29204200	emergency medical technician	Class	emergency medical technician or paramedics	Emergency Medical Technicians	Assess injuries and illnesses and administer basic emergency medical care. May transport injured or sick persons to medical facilities.	https://www.bls.gov/soc/		Sam Smith|Oliver He			
OCCO:29204300	paramedic	Class	emergency medical technician or paramedics	Paramedics	"Administer basic or advanced emergency medical care and assess injuries and illnesses. May administer medication intravenously, use equipment such as EKGs, or administer advanced life support to sick or injured individuals."	https://www.bls.gov/soc/		Sam Smith|Oliver He			
OCCO:29205000	health practitioner support technologist or technician	Class	health technologist or technician	Health Practitioner Support Technologists and Technicians		https://www.bls.gov/soc/		Sam Smith|Oliver He			
OCCO:29206000	licensed practical or licensed vocational nurses	Class	health technologist or technician	Licensed Practical and Licensed Vocational Nurses		https://www.bls.gov/soc/		Sam Smith|Oliver He			
OCCO:29207000	medical records specialist (broad)	Class	health technologist or technician	Medical Records Specialists		https://www.bls.gov/soc/		Sam Smith|Oliver He			
OCCO:29207200	medical records specialist	Class	medical records specialist (broad)	Medical Records Specialists	"Compile, process, and maintain medical records of hospital and clinic patients in a manner consistent with medical, administrative, ethical, legal, and regulatory requirements of the healthcare system. Classify medical and healthcare concepts, including diagnosis, procedures, medical services, and equipment, into the healthcare industry's numerical coding system. Includes medical coders."	https://www.bls.gov/soc/		Sam Smith|Oliver He			
OCCO:29208000	"optician, dispensing (broad)"	Class	health technologist or technician	"Opticians, Dispensing"		https://www.bls.gov/soc/		Sam Smith|Oliver He			
OCCO:29209000	miscellaneous health technologist or technician	Class	health technologist or technician	Miscellaneous Health Technologists and Technicians		https://www.bls.gov/soc/		Sam Smith|Oliver He			
OCCO:29209900	"health technologist or technician, all other"	Class	miscellaneous health technologist or technician	"Health Technologists and Technicians, All Other"	All health technologists and technicians not listed separately.	https://www.bls.gov/soc/		Sam Smith|Oliver He			
OCCO:29900000	other healthcare practitioner or technical occupation	Class	healthcare practitioner or technical occupation holder	Other Healthcare Practitioners and Technical Occupations		https://www.bls.gov/soc/		Sam Smith|Oliver He			
OCCO:29902000	health information technologist or medical registrar (broad)	Class	other healthcare practitioner or technical occupation	Health Information Technologists and Medical Registrars		https://www.bls.gov/soc/		Sam Smith|Oliver He			
OCCO:29902100	health information technologist or medical registrar	Class	health information technologist or medical registrar (broad)	Health Information Technologists and Medical Registrars	"Apply knowledge of healthcare and information systems to assist in the design, development, and continued modification and analysis of computerized healthcare systems. Abstract, collect, and analyze treatment and followup information of patients. May educate staff and assist in problem solving to promote the implementation of the healthcare information system. May design, develop, test, and implement databases with complete history, diagnosis, treatment, and health status to help monitor diseases."	https://www.bls.gov/soc/		Sam Smith|Oliver He			
OCCO:29909000	miscellaneous health practitioner or technical worker	Class	other healthcare practitioner or technical occupation	Miscellaneous Health Practitioners and Technical Workers		https://www.bls.gov/soc/		Sam Smith|Oliver He			
OCCO:29909900	"healthcare practitioner or technical worker, all other"	Class	miscellaneous health practitioner or technical worker	"Healthcare Practitioners and Technical Workers, All Other"	All healthcare practitioners and technical workers not listed separately.	https://www.bls.gov/soc/		Sam Smith|Oliver He			
OCCO:31000000	healthcare support occupation	Class	occupation holder	Healthcare Support Occupations		https://www.bls.gov/soc/		Sam Smith|Oliver He			
